{
  "$schema": "http://json-schema.org/draft-07/schema#",
  "title": "Perfil",
  "description": "Dados pessoais e textos do topo, do \"Sobre\", dos contatos e do rodapé. Também alimentam o currículo em PDF (nome, subtítulo, localização, contatos e o texto do topo como resumo).",
  "type": "object",
  "required": ["name", "shortName", "headline", "intro", "about", "footerNote", "contacts"],
  "additionalProperties": false,
  "properties": {
    "$schema": { "type": "string" },
    "name": {
      "type": "string",
      "minLength": 1,
      "description": "Nome completo: nome do header, título grande do topo e copyright."
    },
    "shortName": {
      "type": "string",
      "minLength": 1,
      "description": "Nome curto exibido no rodapé."
    },
    "headline": {
      "description": "Linha acima do nome, no topo (em maiúsculas, fonte mono); também é o subtítulo do currículo.",
      "$ref": "common.schema.json#/definitions/text"
    },
    "location": {
      "description": "Cidade exibida no topo, no bloco \"Base\". Opcional.",
      "$ref": "common.schema.json#/definitions/text"
    },
    "intro": {
      "description": "Parágrafo do topo, abaixo do nome; também é o resumo do currículo.",
      "$ref": "common.schema.json#/definitions/text"
    },
    "focus": {
      "type": "array",
      "description": "Lista \"Experiência com\" do topo: tipos de problema com que você já trabalhou, na ordem. Opcional.",
      "minItems": 1,
      "items": { "$ref": "common.schema.json#/definitions/text" }
    },
    "portrait": {
      "type": "object",
      "description": "Retrato do topo, ao lado do nome (abaixo dele no celular), recortado em 4:5. Opcional: sem ele, o topo mostra só o texto.",
      "required": ["src", "alt"],
      "additionalProperties": false,
      "properties": {
        "src": { "$ref": "common.schema.json#/definitions/imagePath" },
        "alt": {
          "description": "Descrição do retrato para leitores de tela.",
          "$ref": "common.schema.json#/definitions/text"
        }
      }
    },
    "about": {
      "type": "object",
      "description": "Seção \"Sobre\".",
      "required": ["paragraphs"],
      "additionalProperties": false,
      "properties": {
        "paragraphs": {
          "type": "array",
          "description": "Parágrafos, na ordem em que aparecem; o primeiro sai em destaque.",
          "minItems": 1,
          "items": { "$ref": "common.schema.json#/definitions/text" }
        }
      }
    },
    "footerNote": {
      "description": "Frase do rodapé, abaixo do nome.",
      "$ref": "common.schema.json#/definitions/text"
    },
    "contacts": {
      "type": "array",
      "description": "Contatos, na ordem. Os marcados com \"featured\": true aparecem no topo, na seção Contato e no rodapé; todos aparecem no cabeçalho do currículo.",
      "items": { "$ref": "#/definitions/contact" }
    }
  },
  "definitions": {
    "contact": {
      "type": "object",
      "required": ["label", "url", "text"],
      "additionalProperties": false,
      "properties": {
        "label": {
          "description": "Nome do contato, ex.: \"LinkedIn\". É o texto do link no site (para e-mail, o site mostra o próprio endereço).",
          "$ref": "common.schema.json#/definitions/text"
        },
        "url": { "$ref": "common.schema.json#/definitions/url" },
        "text": {
          "type": "string",
          "minLength": 1,
          "description": "Endereço visível, ex.: \"github.com/danisommer\" (cabeçalho do currículo e seção Contato)."
        },
        "featured": {
          "type": "boolean",
          "description": "true: aparece no topo, na seção Contato e no rodapé."
        }
      },
      "defaultSnippets": [
        {
          "label": "Novo contato",
          "description": "Item de contato (opcionalmente em destaque no site)",
          "body": {
            "label": "${1:Nome}",
            "url": "${2:https://}",
            "text": "${3:texto do link}",
            "featured": false
          }
        }
      ]
    }
  }
}
